{
    "timeStart": "2021-08-18T22:00:00Z",
    "timeEnd": "2021-08-20T13:00:00Z",
    "interval": 3600,
    "weatherParameters": [
        2001,
        1002
    ],
    "locationWeatherData": [
        {
            "longitude": 9.89166,
            "latitude": 59.76152,
            "altitude": 15.0,
            "data": [
                [
                    0.0,
                    10.75
                ],
                [
                    0.0,
                    9.77
                ],
                [
                    0.0,
                    9.38
                ],
                [
                    0.0,
                    9.07
                ],
                [
                    0.0,
                    7.428
                ],
                [
                    0.0,
                    6.713
                ],
                [
                    0.0,
                    null
                ],
                [
                    0.0,
                    8.07
                ],
                [
                    0.0,
                    11.82
                ],
                [
                    0.0,
                    15.79
                ],
                [
                    0.0,
                    17.93
                ],
                [
                    0.0,
                    19.46
                ],
                [
                    0.0,
                    20.6
                ],
                [
                    0.0,
                    21.77
                ],
                [
                    0.0,
                    22.29
                ],
                [
                    0.0,
                    21.29
                ],
                [
                    0.8,
                    18.9
                ],
                [
                    0.0,
                    17.19
                ],
                [
                    0.0,
                    17.46
                ],
                [
                    null,
                    null
                ],
                [
                    null,
                    null
                ],
                [
                    null,
                    null
                ],
                [
                    0.0,
                    9.95
                ],
                [
                    0.0,
                    10.09
                ],
                [
                    0.0,
                    10.33
                ],
                [
                    0.0,
                    9.38
                ],
                [
                    0.0,
                    8.06
                ],
                [
                    0.0,
                    7.072
                ],
                [
                    0.0,
                    5.752
                ],
                [
                    0.0,
                    5.107
                ],
                [
                    0.0,
                    4.955
                ],
                [
                    0.0,
                    5.675
                ],
                [
                    0.0,
                    8.28
                ],
                [
                    0.0,
                    12.65
                ],
                [
                    0.0,
                    16.25
                ],
                [
                    0.0,
                    18.3
                ],
                [
                    0.0,
                    18.91
                ],
                [
                    0.0,
                    18.7
                ],
                [
                    0.0,
                    19.79
                ],
                [
                    0.0,
                    19.83
                ]
            ],
            "qc":
            [
            	4,
            	4
            ]
            ,
            "length": 40,
            "width": 2
        }
    ]
}
