{
    "timeStart": "2021-06-25T00:00:00Z",
    "timeEnd": "2021-06-27T23:00:00Z",
    "interval": 3600,
    "weatherParameters": [
        1002,
        2001,
        3002,
        4003
    ],
    "locationWeatherData": [
        {
            "longitude": 10.86952,
            "latitude": 60.70024,
            "altitude": 262.0,
            "data": [
                [14.6,0,64.9,0.1],
                [13.6,0,72.9,0.5],
                [12.6,0,87,0.8],
                [12.4,0,88,0.2],
                [12.3,0,87.5,0.2],
                [12.5,0,84.2,0.5],
                [13,0,80,0.6],
                [13,0,82.6,0.9],
                [12.9,0,86.7,0.5],
                [13.1,0,85.8,1.3],
                [13.3,0,88.7,1.2],
                [14.4,0,82.1,1],
                [14.1,0.2,84.8,0.4],
                [14.6,0.2,86.8,0.7],
                [14.3,0.3,90.3,0.6],
                [14.3,0,91.7,1.2],
                [14.5,0,81.2,1.4],
                [13.2,0,79.3,1.7],
                [12.9,0,82.3,0.9],
                [12.9,0,84.8,0.6],
                [12.8,0,88.4,1.2],
                [12.9,0,89.3,0.3],
                [12.3,0,89.7,1],
                [11.1,0,94.8,0.2],
                [11.5,0,94.4,0.8],
                [11.9,0,90.6,1.2],
                [11.4,0,92.4,0.4],
                [10.9,0,95.9,1],
                [10.8,0,95.4,0.9],
                [11.7,0,92.3,0.5],
                [12.8,0,87.3,0.5],
                [13.2,0,88,1],
                [14,0,83.1,1],
                [15.7,0,75.4,1.3],
                [16.8,0,71.2,0.9],
                [17.3,0,69.4,1.1],
                [16.5,0,74.3,1.2],
                [16.7,0,75.9,1.6],
                [18.2,0,68.3,1],
                [19.2,0,60.9,0.8],
                [19.1,0,59.5,0.5],
                [19.2,0,60.2,0.2],
                [18.3,0,66.4,0.8],
                [17.7,0,71.4,0.8],
                [16.7,0,73.8,0.7],
                [16.1,0,78.7,0.3],
                [16,0,76.5,1.1],
                [15.7,0,61.6,1.9],
                [14.5,0,59.4,1.3],
                [13.2,0,59.7,0.9],
                [12.3,0,64.3,1.5],
                [11.5,0,66.2,1.8],
                [10.9,0,66.4,2.1],
                [10.6,0,66.9,1.7],
                [11.5,0,64.5,1.4],
                [12.2,0,64,2],
                [13.1,0,59.5,2.2],
                [14.2,0,55.1,1.6],
                [15.4,0,52,1],
                [16.8,0,49.9,0.9],
                [17.8,0,47.4,0.7],
                [19,0,42.8,1.1],
                [20,0,40.4,1.8],
                [20.5,0,40.2,1],
                [20.3,0,38.1,3.2],
                [20.4,0,36.1,2.8],
                [20.2,0,36.3,3],
                [19.4,0,38.1,1.7],
                [18.4,0,40.4,0.5],
                [16.7,0,47.8,0.7],
                [15.7,0,50.1,0.6],
                [14.5,0,52.8,0.7]
            ],
            "qc":
            [
            	2,
            	2,
                2,
                2
            ]
            ,
            "length": 72,
            "width": 4
        }
    ]
}
